{
  "schema_version": 1,
  "ingress_id": "lab-wireless-ingress",
  "sources": [
    {
      "source_id": "emg-left",
      "endpoints": ["tcp://192.168.100.40:19001", "tcp://192.168.100.41:19001"],
      "topic": "wireless/v1/emg-left",
      "expected_sample_rate": {"numerator_hz": 1000, "denominator": 1},
      "expected_channel_count": 8,
      "expected_sample_format": "SAMPLE_FORMAT_INT16_LE",
      "max_batch_samples": 64,
      "queue_capacity_batches": 256,
      "reconnect_min_ms": 250,
      "reconnect_max_ms": 10000,
      "allow_replay": true
    },
    {
      "source_id": "emg-right",
      "endpoints": ["tcp://192.168.100.42:19002"],
      "topic": "wireless/v1/emg-right",
      "expected_sample_rate": {"numerator_hz": 1000, "denominator": 1},
      "expected_channel_count": 8,
      "expected_sample_format": "SAMPLE_FORMAT_INT16_LE",
      "max_batch_samples": 64,
      "queue_capacity_batches": 256
    }
  ],
  "mux": {
    "mode": "round_robin_nonblocking",
    "queue_capacity_batches": 1024,
    "max_batch_bytes": 1048576,
    "gap_policy": "diagnose_and_preserve"
  }
}
